<?xml version='1.0' encoding='UTF-8'?>
<addon id="PointsLines" xmlns="http://icplayer.com" xmlns:xsi="http://www.w3.org/2001/XMLSchema-instance" xsi:schemaLocation="http://icplayer.com ../../tools/addon.xsd">
	<model>
		<property name="Points" type="text" displayName="Points' coordinates"/>
		<property name="Indexes" type="text" displayName="Points' indexes"/>
		<property name="Starting lines" type="text" displayName="Starting lines"/>
		<property name="Lines" type="text" displayName="Answer"/>
		<property name="Is activity" type="boolean"/>
		<property name="Is disabled" type="boolean"/>
	</model>
</addon>