<?xml version='1.0' encoding='UTF-8' ?>

<addon id='video' xmlns="http://icplayer.com" xmlns:xsi="http://www.w3.org/2001/XMLSchema-instance" xsi:schemaLocation="http://icplayer.com ../../tools/addon.xsd">
	<model>
		<property name='Files' type='list'>
			<property name="Ogg video" displayName="Ogv video" type="file" />
			<property name="MP4 video" type="file" />
			<property name="WebM video" type="file" />
			<property name="Subtitles" type="text" isLocalized="true" />
			<property name="Poster" type="image" />
			<property name="ID" type="string" />
		</property>
		<property name="Show video" type="string" />
		<property name="Narration" type="narration" isLocalized="true" />
	</model>
</addon>